{
  "schema_id": "SLWPBoundaryTest.v1",
  "test_id": "slwp-finite-product-counterexample-v1",
  "mu_id": "mu1",
  "lower_freeze": {
    "states": [0, 1],
    "laws": "finite identity dynamics",
    "resource_bound": "complete finite enumeration"
  },
  "higher_candidate": {
    "states": ["0:0", "0:1", "1:0", "1:1"],
    "claimed_freedom": "one extra binary coordinate"
  },
  "projection_map": {
    "definition": "U(x,b)=x",
    "recovery_test": "U(s(x))=x for both lower states"
  },
  "section_map": {
    "definition": "s(x)=(x,0)",
    "selector": "constant zero second coordinate"
  },
  "fiber_witness": {
    "h": "0:1",
    "s_of_U_h": "0:0",
    "different": true
  },
  "recovery_result": {
    "U_after_s_identity": true,
    "s_after_U_identity": false
  },
  "reducible_counterexample": {
    "complete_lower_generator": "Cartesian product with a finite bit",
    "fully_reducible": true
  },
  "novelty_discriminator": "A higher behavior not generated by the frozen finite product construction.",
  "held_out_prediction": "No such behavior exists in this counterexample.",
  "projection_result": "PROJECTION_ASYMMETRY_PROVEN",
  "ontology_result": "REDUCED",
  "strong_emergence_established": false,
  "kill": "Any claimed strong-emergence inference is killed by the complete finite generator.",
  "survivor": "The reconstruction-asymmetry lemma remains valid."
}
